{
  "diagnostics": [
    {
      "capabilities": [],
      "confidence": "high",
      "evidence": [
        "reference = XamariniOS@2"
      ],
      "fix": {
        "description": "resolve and replace the reference with an immutable revision",
        "kind": "pin-dependency",
        "replacement": null,
        "span": {
          "file": "azure/softeq/mapbox-xamarin/azure-pipelines.yml",
          "start": {
            "byte": 186,
            "column": 11,
            "line": 17
          },
          "stop": {
            "byte": 198,
            "column": 23,
            "line": 17
          }
        }
      },
      "id": "diag_336310e52e00e33ddd8b",
      "message": "dependency is not pinned to immutable content: XamariniOS@2",
      "rule_id": "WV-SUPPLY-001",
      "severity": "warning",
      "span": {
        "file": "azure/softeq/mapbox-xamarin/azure-pipelines.yml",
        "start": {
          "byte": 186,
          "column": 11,
          "line": 17
        },
        "stop": {
          "byte": 198,
          "column": 23,
          "line": 17
        }
      },
      "trace": [
        {
          "label": "mutable dependency",
          "node_id": "wv_514dd2aff283df6e8ea9",
          "span": {
            "file": "azure/softeq/mapbox-xamarin/azure-pipelines.yml",
            "start": {
              "byte": 186,
              "column": 11,
              "line": 17
            },
            "stop": {
              "byte": 198,
              "column": 23,
              "line": 17
            }
          }
        }
      ]
    }
  ],
  "digest": "sha256:497ab8b6abed1f4dc06a4c018911125aae6732ad582292b4c2da5a7dfb30d07d",
  "graphs": [
    {
      "edges": [
        {
          "condition": true,
          "from": "wv_103da2628d5e3e5f47a6",
          "id": "wv_06d733a7761346f7bd09",
          "kind": "control",
          "label": null,
          "to": "wv_0fd97e3700524ac74c8b"
        },
        {
          "condition": true,
          "from": "wv_22bce8787fe042976cfc",
          "id": "wv_07ffae2d233c7fe4772d",
          "kind": "control",
          "label": null,
          "to": "wv_514dd2aff283df6e8ea9"
        },
        {
          "condition": true,
          "from": "wv_0fd97e3700524ac74c8b",
          "id": "wv_2f36912d95b1e0c7236d",
          "kind": "control",
          "label": null,
          "to": "wv_22bce8787fe042976cfc"
        },
        {
          "condition": true,
          "from": "wv_22bce8787fe042976cfc",
          "id": "wv_3517f293c4e5aaf97be2",
          "kind": "call",
          "label": null,
          "to": "wv_514dd2aff283df6e8ea9"
        },
        {
          "condition": true,
          "from": "wv_8b0035f199eb99670b0e",
          "id": "wv_f6a043bfd2ce46beb310",
          "kind": "control",
          "label": null,
          "to": "wv_103da2628d5e3e5f47a6"
        }
      ],
      "entrypoints": [
        "wv_103da2628d5e3e5f47a6"
      ],
      "nodes": [
        {
          "attributes": {},
          "capabilities": [],
          "condition": true,
          "effects": [],
          "id": "wv_0fd97e3700524ac74c8b",
          "kind": "job",
          "name": "macOS",
          "phase": "plan",
          "provider": "azure",
          "span": {
            "file": "azure/softeq/mapbox-xamarin/azure-pipelines.yml",
            "start": {
              "byte": 119,
              "column": 3,
              "line": 12
            },
            "stop": {
              "byte": 407,
              "column": 28,
              "line": 24
            }
          },
          "unknown": null
        },
        {
          "attributes": {},
          "capabilities": [],
          "condition": true,
          "effects": [],
          "id": "wv_103da2628d5e3e5f47a6",
          "kind": "workflow",
          "name": "Azure pipeline",
          "phase": "compile",
          "provider": "azure",
          "span": {
            "file": "azure/softeq/mapbox-xamarin/azure-pipelines.yml",
            "start": {
              "byte": 0,
              "column": 1,
              "line": 1
            },
            "stop": {
              "byte": 407,
              "column": 28,
              "line": 24
            }
          },
          "unknown": null
        },
        {
          "attributes": {},
          "capabilities": [],
          "condition": true,
          "effects": [],
          "id": "wv_22bce8787fe042976cfc",
          "kind": "step",
          "name": "Build Xamarin.iOS solution **/*.sln",
          "phase": "run",
          "provider": "azure",
          "span": {
            "file": "azure/softeq/mapbox-xamarin/azure-pipelines.yml",
            "start": {
              "byte": 180,
              "column": 5,
              "line": 17
            },
            "stop": {
              "byte": 407,
              "column": 28,
              "line": 24
            }
          },
          "unknown": null
        },
        {
          "attributes": {},
          "capabilities": [
            "shell"
          ],
          "condition": true,
          "effects": [
            "command_execution"
          ],
          "id": "wv_514dd2aff283df6e8ea9",
          "kind": "call",
          "name": "XamariniOS@2",
          "phase": "run",
          "provider": "azure",
          "span": {
            "file": "azure/softeq/mapbox-xamarin/azure-pipelines.yml",
            "start": {
              "byte": 186,
              "column": 11,
              "line": 17
            },
            "stop": {
              "byte": 198,
              "column": 23,
              "line": 17
            }
          },
          "unknown": {
            "detail": "XamariniOS@2",
            "kind": "unresolved_dependency"
          }
        },
        {
          "attributes": {},
          "capabilities": [],
          "condition": true,
          "effects": [],
          "id": "wv_8b0035f199eb99670b0e",
          "kind": "trigger",
          "name": "trigger",
          "phase": "source",
          "provider": "azure",
          "span": {
            "file": "azure/softeq/mapbox-xamarin/azure-pipelines.yml",
            "start": {
              "byte": 35,
              "column": 3,
              "line": 4
            },
            "stop": {
              "byte": 109,
              "column": 18,
              "line": 9
            }
          },
          "unknown": null
        }
      ],
      "provider": "azure",
      "source": "azure/softeq/mapbox-xamarin/azure-pipelines.yml"
    }
  ],
  "inputs": [
    {
      "digest": "sha256:d9f162d471ef957cb0c65b46189f2a2d173c5edb3849ac99f9b552b1ee6a3e15",
      "path": "azure/softeq/mapbox-xamarin/azure-pipelines.yml"
    }
  ],
  "persona": "audit",
  "properties": [
    {
      "explanation": "AI agent input is trusted or isolated from tools and network",
      "id": "WV-AI-001",
      "reasons": [],
      "state": "NotApplicable",
      "subject": null
    },
    {
      "explanation": "artifact integrity is preserved across producers and consumers",
      "id": "WV-ARTIFACT-001",
      "reasons": [],
      "state": "NotApplicable",
      "subject": null
    },
    {
      "explanation": "every privileged effect is dominated by an authorization gate",
      "id": "WV-AUTH-001",
      "reasons": [],
      "state": "NotApplicable",
      "subject": null
    },
    {
      "explanation": "cache integrity is preserved across producers and consumers",
      "id": "WV-CACHE-001",
      "reasons": [],
      "state": "NotApplicable",
      "subject": null
    },
    {
      "explanation": "the lowered graph is well-formed, phase-valid, and acyclic",
      "id": "WV-CORRECT-001",
      "reasons": [],
      "state": "Proved",
      "subject": null
    },
    {
      "explanation": "credentials do not persist into reusable runner state",
      "id": "WV-CRED-001",
      "reasons": [],
      "state": "NotApplicable",
      "subject": null
    },
    {
      "explanation": "granted capabilities are required by a reachable effect",
      "id": "WV-PERM-001",
      "reasons": [],
      "state": "NotApplicable",
      "subject": null
    },
    {
      "explanation": "untrusted values do not cross an unquoted command boundary",
      "id": "WV-SEC-001",
      "reasons": [],
      "state": "NotApplicable",
      "subject": null
    },
    {
      "explanation": "secret values do not reach network, output, or logging effects",
      "id": "WV-SEC-002",
      "reasons": [],
      "state": "NotApplicable",
      "subject": null
    },
    {
      "explanation": "workflow execution cannot rewrite trusted CI definitions",
      "id": "WV-SELF-001",
      "reasons": [],
      "state": "NotApplicable",
      "subject": null
    },
    {
      "explanation": "remote executable dependencies are content-addressed",
      "id": "WV-SUPPLY-001",
      "reasons": [],
      "state": "Violated",
      "subject": null
    },
    {
      "explanation": "untrusted checkout selection cannot race a privileged consumer",
      "id": "WV-TOCTOU-001",
      "reasons": [],
      "state": "NotApplicable",
      "subject": null
    }
  ],
  "schema": "report-v1",
  "summary": {
    "diagnostics": 1,
    "graphs": 1,
    "inputs": 1,
    "unknown_properties": 0
  },
  "tool": {
    "name": "workflow-verifier",
    "version": "0.1.0-dev"
  }
}
