{
  "diagnostics": [],
  "digest": "sha256:de347d4b73439d405a6f0117ef524b8d612b14f75e2bf1d2af30b35ab8942fd5",
  "graphs": [
    {
      "edges": [],
      "entrypoints": [
        "wv_43287fe88850e1ae0b06"
      ],
      "nodes": [
        {
          "attributes": {},
          "capabilities": [],
          "condition": true,
          "effects": [],
          "id": "wv_43287fe88850e1ae0b06",
          "kind": "workflow",
          "name": "Azure pipeline",
          "phase": "compile",
          "provider": "azure",
          "span": {
            "file": "azure/numba/numba-scipy/azure-pipelines.yml",
            "start": {
              "byte": 0,
              "column": 1,
              "line": 1
            },
            "stop": {
              "byte": 796,
              "column": 29,
              "line": 34
            }
          },
          "unknown": null
        }
      ],
      "provider": "azure",
      "source": "azure/numba/numba-scipy/azure-pipelines.yml"
    }
  ],
  "inputs": [
    {
      "digest": "sha256:1bc60b528b23c32d4cca0964896befdd8dc1eba872df100503a11fd671735019",
      "path": "azure/numba/numba-scipy/azure-pipelines.yml"
    }
  ],
  "persona": "audit",
  "properties": [
    {
      "explanation": "AI agent input is trusted or isolated from tools and network",
      "id": "WV-AI-001",
      "reasons": [],
      "state": "NotApplicable",
      "subject": null
    },
    {
      "explanation": "artifact integrity is preserved across producers and consumers",
      "id": "WV-ARTIFACT-001",
      "reasons": [],
      "state": "NotApplicable",
      "subject": null
    },
    {
      "explanation": "every privileged effect is dominated by an authorization gate",
      "id": "WV-AUTH-001",
      "reasons": [],
      "state": "NotApplicable",
      "subject": null
    },
    {
      "explanation": "cache integrity is preserved across producers and consumers",
      "id": "WV-CACHE-001",
      "reasons": [],
      "state": "NotApplicable",
      "subject": null
    },
    {
      "explanation": "the lowered graph is well-formed, phase-valid, and acyclic",
      "id": "WV-CORRECT-001",
      "reasons": [],
      "state": "Proved",
      "subject": null
    },
    {
      "explanation": "credentials do not persist into reusable runner state",
      "id": "WV-CRED-001",
      "reasons": [],
      "state": "NotApplicable",
      "subject": null
    },
    {
      "explanation": "granted capabilities are required by a reachable effect",
      "id": "WV-PERM-001",
      "reasons": [],
      "state": "NotApplicable",
      "subject": null
    },
    {
      "explanation": "untrusted values do not cross an unquoted command boundary",
      "id": "WV-SEC-001",
      "reasons": [],
      "state": "NotApplicable",
      "subject": null
    },
    {
      "explanation": "secret values do not reach network, output, or logging effects",
      "id": "WV-SEC-002",
      "reasons": [],
      "state": "NotApplicable",
      "subject": null
    },
    {
      "explanation": "workflow execution cannot rewrite trusted CI definitions",
      "id": "WV-SELF-001",
      "reasons": [],
      "state": "NotApplicable",
      "subject": null
    },
    {
      "explanation": "remote executable dependencies are content-addressed",
      "id": "WV-SUPPLY-001",
      "reasons": [],
      "state": "NotApplicable",
      "subject": null
    },
    {
      "explanation": "untrusted checkout selection cannot race a privileged consumer",
      "id": "WV-TOCTOU-001",
      "reasons": [],
      "state": "NotApplicable",
      "subject": null
    }
  ],
  "schema": "report-v1",
  "summary": {
    "diagnostics": 0,
    "graphs": 1,
    "inputs": 1,
    "unknown_properties": 0
  },
  "tool": {
    "name": "workflow-verifier",
    "version": "0.1.0-dev"
  }
}
